{
  "id": "OBS-HAL-03",
  "title": "Allocation execution window is more restrictive than the settlement model",
  "artifact_type": "finding",
  "source_kind": "audit_report",
  "source_title": "Tradecraft AMM - Obsidian - Halborn",
  "source_url": "https://www.halborn.com/audits/obsidian/tradecraft-amm-1e29e9",
  "repo": "obsidian-systems/tradecraft/canton-swap-amm",
  "date": "2025-12-29",
  "target_object": "Allocation execution window",
  "affected_modules": ["AMM.daml"],
  "pattern_family": "temporal",
  "pattern_name": "overly_restrictive_execution_window",
  "severity": "medium",
  "bvss_score": null,
  "bvss_vector": null,
  "evidence_strength": "moderate",
  "explicit_bugfix": true,
  "explicit_security": true,
  "inferred_pattern": true,
  "synthetic": false,
  "before_version": "ad2619c",
  "after_version": "d9ee989",
  "before_after_available": true,
  "description": "The allocation execution window is more restrictive than what the settlement model allows. Legitimate settlement operations may fail because the allocation's time constraints are tighter than the settlement's overall timeline, creating unnecessary execution failures.",
  "recommendation": "Align the allocation execution window with the settlement model's timing constraints to avoid rejecting valid operations.",
  "code_snippets": {"buggy": "buggy/AllocationWindow.daml", "fixed": "fixed/AllocationWindow.daml", "diff": "diff.patch"},
  "oracle": {
    "type": "spec_nonconformance",
    "description": "Allocation time window is stricter than the settlement model's window, causing valid operations to be rejected.",
    "static_signal": "Time window validation in allocation that uses stricter bounds than the parent settlement's time window",
    "symbolic_property": "allocation.executionWindow is subset of settlement.executionWindow"
  },
  "good_for_static": true,
  "good_for_symbolic": true,
  "good_for_benchmark": true,
  "tags": ["AMM", "time-window", "settlement", "allocation", "spec-conformance"],
  "notes": "Temporal window misalignment is a recurring DAML audit finding."
}
