{
  "id": "OBS-HAL-09",
  "title": "Requests and relationships cannot be explicitly revoked once created",
  "artifact_type": "finding",
  "source_kind": "audit_report",
  "source_title": "Tradecraft AMM - Obsidian - Halborn",
  "source_url": "https://www.halborn.com/audits/obsidian/tradecraft-amm-1e29e9",
  "repo": "obsidian-systems/tradecraft/canton-swap-amm",
  "date": "2025-12-29",
  "target_object": "AMMRulesRequest / AMMRules",
  "affected_modules": ["AMMRulesRequest.daml", "AMMRules.daml"],
  "pattern_family": "lifecycle",
  "pattern_name": "missing_revocation_mechanism",
  "severity": "low",
  "bvss_score": null,
  "bvss_vector": null,
  "evidence_strength": "moderate",
  "explicit_bugfix": true,
  "explicit_security": true,
  "inferred_pattern": true,
  "synthetic": false,
  "before_version": "ad2619c",
  "after_version": "c838e6a",
  "before_after_available": true,
  "description": "Once requests or operational relationships (e.g., AMMRules) are created, there is no explicit mechanism to revoke or cancel them. This means that even if circumstances change (e.g., a party should no longer have access), the existing contracts remain active indefinitely.",
  "recommendation": "Add explicit revocation/cancellation choices that allow authorized parties to archive requests and relationships when they are no longer needed.",
  "code_snippets": {
    "buggy": "buggy/AMMRules.daml",
    "fixed": "fixed/AMMRules.daml",
    "diff": "diff.patch"
  },
  "oracle": {
    "type": "missing_check",
    "description": "Templates lack explicit choices for cancellation/revocation, relying only on the implicit Archive which may not have the right authorization model.",
    "static_signal": "Template without any consuming choice that acts as cancellation/revocation; only the implicit Archive is available",
    "symbolic_property": "exists choice c on AMMRules: exercising c archives the contract AND c is authorized by the appropriate governance party"
  },
  "good_for_static": true,
  "good_for_symbolic": false,
  "good_for_benchmark": true,
  "tags": ["lifecycle", "revocation", "offboarding", "access-control"],
  "notes": "Missing revocation is a recurring DAML design issue."
}
