{
  "id": "OBS-HAL-08",
  "title": "Exact Decimal comparisons on computed values",
  "artifact_type": "finding",
  "source_kind": "audit_report",
  "source_title": "Tradecraft AMM - Obsidian - Halborn",
  "source_url": "https://www.halborn.com/audits/obsidian/tradecraft-amm-1e29e9",
  "repo": "obsidian-systems/tradecraft/canton-swap-amm",
  "date": "2025-12-29",
  "target_object": "Decimal comparison logic",
  "affected_modules": ["AMM.daml"],
  "pattern_family": "invariant",
  "pattern_name": "exact_decimal_comparison",
  "severity": "low",
  "bvss_score": null,
  "bvss_vector": null,
  "evidence_strength": "moderate",
  "explicit_bugfix": true,
  "explicit_security": true,
  "inferred_pattern": true,
  "synthetic": false,
  "before_version": "ad2619c",
  "after_version": "0800c48",
  "before_after_available": true,
  "description": "The code uses exact equality (==) to compare Decimal values that are the result of arithmetic computations. Due to rounding behavior in fixed-point arithmetic, computed values may differ by tiny amounts that are functionally equivalent but fail exact equality checks, causing spurious assertion failures.",
  "recommendation": "Use tolerance-based comparison or ensure that all compared values go through the same rounding pipeline before comparison.",
  "code_snippets": {
    "buggy": "buggy/DecimalCompare.daml",
    "fixed": "fixed/DecimalCompare.daml",
    "diff": "diff.patch"
  },
  "oracle": {
    "type": "assertion_violation",
    "description": "Exact equality comparison on computed Decimal values may fail due to rounding differences.",
    "static_signal": "Use of == on Decimal values that are results of arithmetic operations (multiplication, division) rather than direct field access",
    "symbolic_property": "forall a b: computed_decimal(a) == computed_decimal(b) is unreliable; use |a - b| < epsilon"
  },
  "good_for_static": true,
  "good_for_symbolic": true,
  "good_for_benchmark": true,
  "tags": ["decimal-precision", "floating-point", "comparison", "rounding"],
  "notes": "DAML uses fixed-point 38-digit Decimal, not floating point. But division still produces rounding, making exact comparison unreliable on computed values."
}
