{
  "id": "OBS-HAL-01",
  "title": "LP token supply can be created or consumed from a different pool",
  "artifact_type": "finding",
  "source_kind": "audit_report",
  "source_title": "Tradecraft AMM - Obsidian - Halborn",
  "source_url": "https://www.halborn.com/audits/obsidian/tradecraft-amm-1e29e9",
  "repo": "obsidian-systems/tradecraft/canton-swap-amm",
  "date": "2025-12-29",
  "target_object": "LP token minting / pool isolation",
  "affected_modules": ["AMM.daml"],
  "pattern_family": "auth",
  "pattern_name": "cross_pool_token_manipulation",
  "severity": "critical",
  "bvss_score": null,
  "bvss_vector": null,
  "evidence_strength": "moderate",
  "explicit_bugfix": true,
  "explicit_security": true,
  "inferred_pattern": true,
  "synthetic": false,
  "before_version": "ad2619c",
  "after_version": "1ce875c",
  "before_after_available": true,
  "description": "LP (Liquidity Provider) tokens associated with one liquidity pool can be created or consumed in the context of a different pool. This breaks the fundamental invariant that LP token supply should be scoped to a specific pool, enabling cross-pool token manipulation that could lead to unauthorized liquidity extraction or inflation of LP token supply.",
  "recommendation": "Enforce that LP token operations (mint/burn) validate the pool identity, ensuring tokens can only be created or consumed within their originating pool.",
  "code_snippets": {"buggy": "buggy/LPToken.daml", "fixed": "fixed/LPToken.daml", "diff": "diff.patch"},
  "oracle": {
    "type": "missing_check",
    "description": "LP token mint/burn operations do not validate that the pool context matches the LP token's associated pool.",
    "static_signal": "Token mint/burn operation that does not assert token.poolId == currentPool.id before modifying supply",
    "symbolic_property": "forall op in {mint_lp, burn_lp}: op.token.poolId == op.pool.id"
  },
  "good_for_static": true,
  "good_for_symbolic": true,
  "good_for_benchmark": true,
  "tags": ["AMM", "liquidity-pool", "LP-token", "cross-pool", "critical-vulnerability"],
  "notes": "Critical severity - could lead to direct fund loss. Classic authorization/scoping bug in multi-pool AMM designs."
}
