{
  "id": "OBS-HAL-04",
  "title": "Multiple liquidity pools can be created for the same instrument pair",
  "artifact_type": "finding",
  "source_kind": "audit_report",
  "source_title": "Tradecraft AMM - Obsidian - Halborn",
  "source_url": "https://www.halborn.com/audits/obsidian/tradecraft-amm-1e29e9",
  "repo": "obsidian-systems/tradecraft/canton-swap-amm",
  "date": "2025-12-29",
  "target_object": "Pool creation uniqueness",
  "affected_modules": ["AMMRulesRequest.daml", "AMMRules.daml"],
  "pattern_family": "invariant",
  "pattern_name": "missing_uniqueness_constraint",
  "severity": "medium",
  "bvss_score": null,
  "bvss_vector": null,
  "evidence_strength": "moderate",
  "explicit_bugfix": true,
  "explicit_security": true,
  "inferred_pattern": true,
  "synthetic": false,
  "before_version": "ad2619c",
  "after_version": "30d7de6",
  "before_after_available": true,
  "description": "The pool creation logic does not enforce uniqueness of instrument pairs, allowing multiple liquidity pools to be created for the same pair of instruments. This fragments liquidity, confuses users, and may lead to arbitrage exploitation across duplicate pools.",
  "recommendation": "Enforce uniqueness of instrument pairs when creating new pools, rejecting creation requests for pairs that already have an active pool.",
  "code_snippets": {"buggy": "buggy/PoolFactory.daml", "fixed": "fixed/PoolFactory.daml", "diff": "diff.patch"},
  "oracle": {
    "type": "missing_check",
    "description": "Pool creation does not validate that no existing pool already covers the same instrument pair.",
    "static_signal": "Create operation for a pool-like template that does not check for existing contracts with the same key fields (instrument pair)",
    "symbolic_property": "forall p1 p2: active(p1) AND active(p2) AND p1.instrumentPair == p2.instrumentPair => p1 == p2"
  },
  "good_for_static": true,
  "good_for_symbolic": true,
  "good_for_benchmark": true,
  "tags": ["AMM", "uniqueness", "liquidity-fragmentation", "duplicate-pool"],
  "notes": "DAML has contract keys for uniqueness enforcement, but they may not have been used here."
}
