{
  "id": "OBS-HAL-02",
  "title": "User controlled transfer fee parameter enables unauthorized token overpayment",
  "artifact_type": "finding",
  "source_kind": "audit_report",
  "source_title": "Tradecraft AMM - Obsidian - Halborn",
  "source_url": "https://www.halborn.com/audits/obsidian/tradecraft-amm-1e29e9",
  "repo": "obsidian-systems/tradecraft/canton-swap-amm",
  "date": "2025-12-29",
  "target_object": "Transfer fee parameter validation",
  "affected_modules": ["AMMFees.daml"],
  "pattern_family": "auth",
  "pattern_name": "user_controlled_fee_parameter",
  "severity": "critical",
  "bvss_score": null,
  "bvss_vector": null,
  "evidence_strength": "moderate",
  "explicit_bugfix": true,
  "explicit_security": true,
  "inferred_pattern": true,
  "synthetic": false,
  "before_version": "ad2619c",
  "after_version": "7e01d0b",
  "before_after_available": true,
  "description": "The transfer fee parameter is user-controlled and not validated against the authoritative fee configuration. A user can specify an arbitrary fee value in their transaction, potentially causing unauthorized overpayment of tokens to the fee recipient or manipulation of the fee distribution mechanism.",
  "recommendation": "Validate the transfer fee parameter against the authoritative fee configuration stored on-ledger, rejecting any user-supplied fee that does not match the expected value.",
  "code_snippets": {"buggy": "buggy/SwapFee.daml", "fixed": "fixed/SwapFee.daml", "diff": "diff.patch"},
  "oracle": {
    "type": "missing_check",
    "description": "User-supplied fee parameter is not validated against the on-ledger fee configuration before being applied.",
    "static_signal": "Choice parameter for fee/amount that is used in calculations without asserting it matches a fetched on-ledger authoritative value",
    "symbolic_property": "forall tx: tx.fee == fetch(feeConfig).currentFee"
  },
  "good_for_static": true,
  "good_for_symbolic": true,
  "good_for_benchmark": true,
  "tags": ["AMM", "fee-manipulation", "user-controlled-parameter", "critical-vulnerability", "input-validation"],
  "notes": "Critical severity - direct financial impact. Classic 'trust user input' bug applied to fee parameters."
}
