{
  "id": "OBS-HAL-12",
  "title": "Cancellation reason for pool creation requests is not persisted",
  "artifact_type": "finding",
  "source_kind": "audit_report",
  "source_title": "Tradecraft AMM - Obsidian - Halborn",
  "source_url": "https://www.halborn.com/audits/obsidian/tradecraft-amm-1e29e9",
  "repo": "obsidian-systems/tradecraft/canton-swap-amm",
  "date": "2025-12-29",
  "target_object": "Pool creation request cancellation",
  "affected_modules": ["AMMRulesRequest.daml"],
  "pattern_family": "diagnostics",
  "pattern_name": "missing_cancellation_reason",
  "severity": "informational",
  "bvss_score": null,
  "bvss_vector": null,
  "evidence_strength": "moderate",
  "explicit_bugfix": true,
  "explicit_security": true,
  "inferred_pattern": true,
  "synthetic": false,
  "before_version": "ad2619c",
  "after_version": "7b87abc",
  "before_after_available": true,
  "description": "When pool creation requests are cancelled, the reason for cancellation is not persisted on-ledger. This reduces the auditability of the system and makes it difficult to retrospectively understand why certain pool creation attempts were rejected.",
  "recommendation": "Persist the cancellation reason either as a field in a cancellation event or as metadata in the archive operation.",
  "code_snippets": {
    "buggy": "buggy/PoolCancellation.daml",
    "fixed": "fixed/PoolCancellation.daml",
    "diff": "diff.patch"
  },
  "oracle": {
    "type": "misleading_diagnostic",
    "description": "Cancellation operation does not record the reason, reducing audit trail quality.",
    "static_signal": "Archive/cancel choice that does not create an event or record with a reason/rationale field",
    "symbolic_property": null
  },
  "good_for_static": true,
  "good_for_symbolic": false,
  "good_for_benchmark": false,
  "tags": ["audit-trail", "cancellation-reason", "traceability"],
  "notes": "Low benchmark value. Indistinguishable audit records are a recurring DAML audit finding."
}
