{
  "id": "OBS-HAL-11",
  "title": "Lack of explicit venue and vault consistency checks when creating pool requests",
  "artifact_type": "finding",
  "source_kind": "audit_report",
  "source_title": "Tradecraft AMM - Obsidian - Halborn",
  "source_url": "https://www.halborn.com/audits/obsidian/tradecraft-amm-1e29e9",
  "repo": "obsidian-systems/tradecraft/canton-swap-amm",
  "date": "2025-12-29",
  "target_object": "Pool creation request validation",
  "affected_modules": ["AMMRulesRequest.daml"],
  "pattern_family": "invariant",
  "pattern_name": "missing_cross_entity_validation",
  "severity": "informational",
  "bvss_score": null,
  "bvss_vector": null,
  "evidence_strength": "moderate",
  "explicit_bugfix": true,
  "explicit_security": true,
  "inferred_pattern": true,
  "synthetic": false,
  "before_version": "ad2619c",
  "after_version": "7b87abc",
  "before_after_available": true,
  "description": "When creating pool requests, there are no explicit checks to ensure that the specified venue and vault are consistent (e.g., that the vault belongs to the specified venue). This could allow pool creation with mismatched venue/vault combinations, leading to operational issues.",
  "recommendation": "Add validation that the venue and vault referenced in pool creation requests are consistent with each other.",
  "code_snippets": {
    "buggy": "buggy/PoolRequest.daml",
    "fixed": "fixed/PoolRequest.daml",
    "diff": "diff.patch"
  },
  "oracle": {
    "type": "missing_check",
    "description": "Pool creation does not validate consistency between venue and vault references.",
    "static_signal": "Create/exercise that references multiple related entities (venue, vault) without asserting their relationship",
    "symbolic_property": "forall req: poolRequest: req.vault.venue == req.venue"
  },
  "good_for_static": true,
  "good_for_symbolic": true,
  "good_for_benchmark": true,
  "tags": ["AMM", "cross-entity-validation", "venue", "vault", "consistency"],
  "notes": "Common pattern: multiple related entity references without cross-validation of their relationships."
}
