{
  "id": "TEMPLE-HAL-04",
  "title": "Unsafe list access assumptions on transfer operation results",
  "artifact_type": "finding",
  "source_kind": "audit_report",
  "source_title": "DAML Contracts - Temple - Halborn",
  "source_url": "https://www.halborn.com/audits/temple/daml-contracts-225b21",
  "repo": "Temple-Digital-Group/temple-daml-contracts",
  "date": "2025-11-25",
  "target_object": "Transfer result list access",
  "affected_modules": ["Temple/Order/Process/Definitions/Transfer.daml"],
  "pattern_family": "invariant",
  "pattern_name": "unsafe_list_access",
  "severity": "low",
  "bvss_score": null,
  "bvss_vector": null,
  "evidence_strength": "moderate",
  "explicit_bugfix": true,
  "explicit_security": true,
  "inferred_pattern": true,
  "synthetic": true,
  "before_version": "6b715a9",
  "after_version": "bdc97a4",
  "before_after_available": true,
  "description": "The code makes unsafe assumptions about the length of lists returned from transfer operations, using head/tail or index access without checking that the list has the expected number of elements. If a transfer returns fewer results than expected (e.g., due to edge cases), this would cause a runtime crash.",
  "recommendation": "Replace unsafe list access with safe pattern matching or explicit length checks before indexing.",
  "code_snippets": {"buggy": "buggy/TransferResult.daml", "fixed": "fixed/TransferResult.daml", "diff": "diff.patch"},
  "oracle": {
    "type": "assertion_violation",
    "description": "List access (head, !!, tail) is used on transfer results without length validation, risking runtime errors on empty or short lists.",
    "static_signal": "Use of 'head', '!!', or 'tail' on a list without prior length check or pattern match; especially on return values from external operations",
    "symbolic_property": "forall r in transferResults: length(r) >= expected_count before access"
  },
  "good_for_static": true,
  "good_for_symbolic": true,
  "good_for_benchmark": true,
  "tags": ["runtime-safety", "list-access", "partial-function", "crash-risk"],
  "notes": "Common DAML/Haskell bug: using partial functions (head, !!) on potentially empty lists. Easily detectable by static analysis."
}
