{
  "id": "TEMPLE-HAL-02",
  "title": "Missing expiration validation during order matching",
  "artifact_type": "finding",
  "source_kind": "audit_report",
  "source_title": "DAML Contracts - Temple - Halborn",
  "source_url": "https://www.halborn.com/audits/temple/daml-contracts-225b21",
  "repo": "Temple-Digital-Group/temple-daml-contracts",
  "date": "2025-11-25",
  "target_object": "Order matching logic",
  "affected_modules": ["Temple/Order/Orchestrator.daml"],
  "pattern_family": "temporal",
  "pattern_name": "missing_expiration_check",
  "severity": "medium",
  "bvss_score": null,
  "bvss_vector": null,
  "evidence_strength": "moderate",
  "explicit_bugfix": true,
  "explicit_security": true,
  "inferred_pattern": true,
  "synthetic": true,
  "before_version": "6b715a9",
  "after_version": "bdc97a4",
  "before_after_available": true,
  "description": "The order matching logic does not validate whether orders have expired before proceeding with the match. Expired orders can be matched against live orders, leading to invalid settlements or wasted resources on orders that should no longer be active.",
  "recommendation": "Add expiration time validation at the point of order matching to reject expired orders before they enter the matching workflow.",
  "code_snippets": {"buggy": "buggy/OrderMatching.daml", "fixed": "fixed/OrderMatching.daml", "diff": "diff.patch"},
  "oracle": {
    "type": "missing_check",
    "description": "The order matching function does not check order expiration time against current ledger time before proceeding.",
    "static_signal": "Order matching function that fetches/exercises orders without checking an expiration/deadline field against getTime",
    "symbolic_property": "forall match(o1, o2): ledger_time < o1.expiresAt AND ledger_time < o2.expiresAt"
  },
  "good_for_static": true,
  "good_for_symbolic": true,
  "good_for_benchmark": true,
  "tags": ["order-management", "expiration", "temporal-validation", "matching-engine"],
  "notes": "Common DAML bug: forgetting to validate time constraints at key state transitions."
}
