{
  "id": "TEMPLE-HAL-07",
  "title": "Non-deterministic maker-taker assignment for concurrent orders",
  "artifact_type": "finding",
  "source_kind": "audit_report",
  "source_title": "DAML Contracts - Temple - Halborn",
  "source_url": "https://www.halborn.com/audits/temple/daml-contracts-225b21",
  "repo": "Temple-Digital-Group/temple-daml-contracts",
  "date": "2025-11-25",
  "target_object": "Maker/taker role assignment",
  "affected_modules": ["Temple/Order/Orchestrator.daml"],
  "pattern_family": "invariant",
  "pattern_name": "nondeterministic_role_assignment",
  "severity": "informational",
  "bvss_score": null,
  "bvss_vector": null,
  "evidence_strength": "moderate",
  "explicit_bugfix": true,
  "explicit_security": true,
  "inferred_pattern": true,
  "synthetic": false,
  "before_version": "6b715a9",
  "after_version": "bdc97a4",
  "before_after_available": true,
  "description": "When two concurrent orders are matched, the assignment of maker vs taker roles is non-deterministic. Depending on the order of contract processing, either party could be assigned either role. This affects fee calculations, priority rules, and any logic that depends on the maker/taker distinction.",
  "recommendation": "Introduce deterministic rules for maker/taker assignment (e.g., based on order creation time, price priority, or explicit role designation).",
  "code_snippets": {"buggy": "buggy/MakerTaker.daml", "fixed": "fixed/MakerTaker.daml", "diff": "diff.patch"},
  "oracle": {
    "type": "state_inconsistency",
    "description": "Maker/taker role assignment depends on non-deterministic execution ordering rather than deterministic criteria.",
    "static_signal": "Role assignment logic that depends on the order of input parameters without explicit sorting/comparison criteria",
    "symbolic_property": "forall o1 o2: match(o1, o2).maker == match(o2, o1).maker (determinism)"
  },
  "good_for_static": false,
  "good_for_symbolic": true,
  "good_for_benchmark": true,
  "tags": ["determinism", "role-assignment", "matching-engine", "fairness"],
  "notes": "Relevant to any DAML matching engine. Non-determinism in DAML is a subtle issue since the ledger model is otherwise deterministic."
}
