{
  "id": "TEMPLE-HAL-05",
  "title": "Order matching does not enforce FIFO ordering",
  "artifact_type": "finding",
  "source_kind": "audit_report",
  "source_title": "DAML Contracts - Temple - Halborn",
  "source_url": "https://www.halborn.com/audits/temple/daml-contracts-225b21",
  "repo": "Temple-Digital-Group/temple-daml-contracts",
  "date": "2025-11-25",
  "target_object": "Order matching / prioritization",
  "affected_modules": ["Temple/Order/Orchestrator.daml"],
  "pattern_family": "invariant",
  "pattern_name": "missing_ordering_enforcement",
  "severity": "low",
  "bvss_score": null,
  "bvss_vector": null,
  "evidence_strength": "moderate",
  "explicit_bugfix": false,
  "explicit_security": true,
  "inferred_pattern": true,
  "synthetic": false,
  "before_version": "6b715a9",
  "after_version": null,
  "before_after_available": true,
  "description": "The order matching logic does not enforce first-in-first-out (FIFO) ordering when selecting orders for matching. Orders may be matched in an arbitrary order rather than by their submission time, potentially causing unfair execution where later orders are matched before earlier ones.",
  "recommendation": "Enforce FIFO ordering in the matching algorithm by sorting or prioritizing orders based on their creation/submission timestamp.",
  "code_snippets": {"buggy": "buggy/FifoMatching.daml", "fixed": "fixed/FifoMatching.daml", "diff": "diff.patch"},
  "oracle": {
    "type": "spec_nonconformance",
    "description": "Order matching does not sort or prioritize by creation time, violating expected FIFO semantics for fair order execution.",
    "static_signal": "Matching function that iterates over a list of orders without sorting by timestamp/creation time field",
    "symbolic_property": "forall o1, o2: matched(o1) AND waiting(o2) AND o2.createdAt < o1.createdAt => contradiction"
  },
  "good_for_static": false,
  "good_for_symbolic": true,
  "good_for_benchmark": true,
  "tags": ["fairness", "ordering", "matching-engine", "FIFO", "risk-accepted"],
  "notes": "Risk Accepted. Enforcing FIFO on a distributed ledger is non-trivial; the team may rely on off-chain ordering. Interesting benchmark for specification-level properties."
}
